;
Absence de précipitations au cours du mois passé;Absence de précipitations au cours du mois passé
Absence de précipitations au cours de la semaine passée;Absence de précipitations au cours de la semaine passée
Absence de précipitations au cours des trois derniers jours;Absence de précipitations au cours des trois derniers jours
Pluvieux, mais sans fortes précipitations au cours des 3 derniers jours;Pluvieux, mais sans fortes précipitations au cours des 3 derniers jours
Pluie modérée depuis plusieurs jours ou forte pluie la veille de l'observation;Pluie modérée depuis plusieurs jours ou forte pluie la veille de l'observation
Très forte précipitations ou chute de neige ou inondation juste avant l'observation;Très forte précipitations ou chute de neige ou inondation juste avant l'observation
Non renseigné;Non renseigné
